"Tamil_Category,English_Category,Tamil_Kural,English_Meaning",
மானம்,Honor,மருந்தோமற்று ஊன்ஓம்பும் வாழ்க்கை பெருந்தகைமை பீடழிய வந்த இடத்து,""Living on to preserve your body, when the greatness of your character is gone – is that an elixir of life""",
மானம்,Honor,மயிர்நீப்பின் வாழாக் கவரிமா அன்னார் உயிர்நீப்பர் மானம் வரின்,""The kavarimaa will cease living if a shred of hair is lost; likewise, there are those who’ll shed their lives, if disgraced""",
மானம்,Honor,இளிவரின் வாழாத மானம் உடையார் ஒளிதொழுது ஏத்தும் உலகு,""The world shall revere their fame, those who are proud enough to face death than ignominy""",
பெருமை,Glory,ஒளிஒருவற்கு உள்ள வெறுக்கை இளிஒருவற்கு அஃதிறந்து வாழ்தும் எனல்,Reputation rests on possession of passion; It’s a disgrace to strive to live if ‘tis foregone",
பெருமை,Glory,பிறப்பொக்கும் எல்லா உயிர்க்கும் சிறப்பொவ்வா செய்தொழில் வேற்றுமை யான்,All beings are born equal. Distinction Comes with difference in deeds",
பெருமை,Glory,மேலிருந்தும் மேலல்லார் மேலல்லர் கீழிருந்தும் கீழல்லார் கீழல் லவர்,""Eminent in stature, but not eminent in deed, is no eminence Lowly in stature, but not lowly in deed, is no lowliness""",
பெருமை,Glory,ஒருமை மகளிரே போலப் பெருமையும் தன்னைத்தான் கொண்டொழுகின் உண்டு,""Like women of virtue, greatness exists Due to steadfast adherence to its virtues""",
பெருமை,Glory,பெருமை யுடையவர் ஆற்றுவார் ஆற்றின் அருமை உடைய செயல்,Those who are bestowed with greatness Do deeds that aren’t commonplace",
பெருமை,Glory,சிறியார் உணர்ச்சியுள் இல்லை பெரியாரைப் பேணிக் கொள் வேம் என்னும் நோக்கு,""The petty do not have it in them, the foresight To embrace and emulate the great""",
பெருமை,Glory,இறப்பே புரிந்த தொழிற்றாம் சிறப்புந்தான் சீரல் லவர்கண் படின்,""The undeserving, if eminence graces, Pompous, lowly conduct ensues""",
பெருமை,Glory,பணியுமாம் என்றும் பெருமை சிறுமை அணியுமாம் தன்னை வியந்து,Greatness has forever humility Pettiness wallows in vanity",
பெருமை,Glory,பெருமை பெருமிதம் இன்மை சிறுமை பெருமிதம் ஊர்ந்து விடல்,Greatness is devoid of pride Pettiness is perfused with bombast",
பெருமை,Glory,அற்றம் மறைக்கும் பெருமை சிறுமைதான் குற்றமே கூறி விடும்,Greatness masks others’ failings Pettiness keeps wailing",
சான்றாண்மை,Evidence of Nobility,கடன்என்ப நல்லவை எல்லாம் கடன்அறிந்து சான்றாண்மை மேற்கொள் பவர்க்கு,""For those who dutifully strive to be noble, To do all that’s good is seen as natural""",
சான்றாண்மை,Evidence of Nobility,குணநலம் சான்றோர் நலனே பிறநலம் எந்நலத்து உள்ளதூஉம் அன்று,""Being good within, is nobility; All else is no quality""",
சான்றாண்மை,Evidence of Nobility,அன்புநாண் ஒப்புரவு கண்ணோட்டம் வாய்மையொடு ஐந்துசால் ஊன்றிய தூண்,""Love, compunction, beneficence, compassion and truthfulness: On these five columns rests nobleness""",
சான்றாண்மை,Evidence of Nobility,கொல்லா நலத்தது நோன்மை பிறர்தீமை சொல்லா நலத்தது சால்பு,The virtue of the ascetic is to not kill any being; The virtue of the noble is to never resort to blaming",
சான்றாண்மை,Evidence of Nobility,ஆற்றுவார் ஆற்றல் பணிதல் அதுசான்றோர் மாற்றாரை மாற்றும் படை,""Humility is the vital capability of the capable: To convert foes, the weapon of the noble""",
சான்றாண்மை,Evidence of Nobility,சால்பிற்குக் கட்டளை யாதெனின் தோல்வி துலையல்லார் கண்ணும் கொளல்,""The mark of nobility, if you ask, Is to concede with grace, defeat by the underdog""",
சான்றாண்மை,Evidence of Nobility,இன்னாசெய் தார்க்கும் இனியவே செய்யாக்கால் என்ன பயத்ததோ சால்பு,Of what use is being noble If one can’t do good unto those who did evil",
சான்றாண்மை,Evidence of Nobility,இன்மை ஒருவற்கு இளிவன்று சால்பென்னும் திண்மை உண் டாகப் பெறின்,Poverty is no disgrace if you possess The strength of nobleness",
சான்றாண்மை,Evidence of Nobility,ஊழி பெயரினும் தாம்பெயரார் சான்றாண்மைக்கு ஆழி எனப்படு வார்,Those known to be the ocean of nobility aren’t perturbed Even when there is the proverbial Flood",
சான்றாண்மை,Evidence of Nobility,சான்றவர் சான்றாண்மை குன்றின் இருநிலந்தான் தாங்காது மன்னோ பொறை,""If the nobility of the noble does erode, The vast earth cannot bear its load""",
பண்புடைமை,Character,எண்பதத்தால் எய்தல் எளிதென்ப யார்மாட்டும் பண்புடைமை என்னும் வழக்கு,Affability with all will help achieve with ease The quality of being courteous",
பண்புடைமை,Character,அன்புடைமை ஆன்ற குடிப்பிறத்தல் இவ்விரண்டும் பண்புடைமை என்னும் வழக்கு,A kind heart and good heredity are considered To make the quality of being well-mannered",
பண்புடைமை,Character,உறுப்பொத்தல் மக்களொப்பு அன்றால் வெறுத்தக்க பண்பொத்தல் ஒப்பதாம் ஒப்பு,Physical resemblance makes not people similar Similar qualities make them similar",
பண்புடைமை,Character,யனொடு நன்றி புரிந்த பயனுடையார் பண்புபா ராட்டும் உலகு,""Being likeable and righteous, they serve all- Their good character the world shall extol""",
பண்புடைமை,Character,நகையுள்ளும் இன்னா திகழ்ச்சி பகையுள்ளும் பண்புள பாடறிவார் மாட்டு,""One who discerns others’ nature and sees merit in foes, Won’t deride others for a laugh that causes many woes""",
பண்புடைமை,Character,பண்புடையார்ப் பட்டுண்டு உலகம் அதுஇன்றேல் மண்புக்கு மாய்வது மன்,The world exists because of courteous people Else it’ll perish by sinking in its own soil",
பண்புடைமை,Character,அரம்போலும் கூர்மைய ரேனும் மரம்போல்வர் மக்கட்பண்பு இல்லா தவர்,""But for humanity, they are but a tree, Though sharp as a rasp they may be""",
பண்புடைமை,Character,நண்பாற்றார் ஆகி நயமில செய்வார்க்கும் பண்பாற்றார் ஆதல் கடை,""Even with those, hostile, and callously act, Behaving ungraciously is a blot""",
பண்புடைமை,Character,நகல்வல்லர் அல்லார்க்கு மாயிரு ஞாலம் பகலும்பாற் பட்டன்று இருள்,For those with no faculty to have fun Darkness swamps the large earth despite the sun",
பண்புடைமை,Character,ண்பிலான் பெற்ற பெருஞ்செல்வம் நன்பால் கலந்தீமை யால்திரிந் தற்று,Good milk spoiled by the vessel that is stained Is wealth in the hands of the uncultured",
நன்றியில்செல்வம்,Wealth through Gratitude,வைத்தான்வாய் சான்ற பெரும்பொருள் அஃதுண்ணான் செத்தான் செயக்கிடந்தது இல்,Wealth allover the house stashed but is not used Makes one impotent as if he is deceased",
நன்றியில்செல்வம்,Wealth through Gratitude,பொருளானாம் எல்லாமென்று ஈயாது இவறும் மருளானாம் மாணாப் பிறப்ப,""Wealth is all, thinking thus, clinging and being ungenerous, Is a delusion leading to a birth most inglorious""",
நன்றியில்செல்வம்,Wealth through Gratitude,ஈட்டம் இவறி இசைவேண்டா ஆடவர் தோற்றம் நிலக்குப் பொறை,""They seek to gain wealth but not fame, being mean: The presence of such men is earth’s burden""",
நன்றியில்செல்வம்,Wealth through Gratitude,எச்சமென்று என்எண்ணுங் கொல்லோ ஒருவரால் நச்சப் படாஅ தவன்,""What’d he think is the legacy he’ll leave, He who has nobody’s love""",
நன்றியில்செல்வம்,Wealth through Gratitude,கொடுப்பதூஉம் துய்ப்பதூஉம் இல்லார்க்கு அடுக்கிய கோடியுண் டாயினும் இல்,""Many billions one may make, but it means nothing If one is neither spending nor giving""",
நன்றியில்செல்வம்,Wealth through Gratitude,ஏதம் பெருஞ்செல்வம் தான்துவ்வான் தக்கார்க்கொன்று ஈதல் இயல்பிலா தான்,""Wealth is a malady, when oneself it doesn’t serve And to the deserving, one isn’t disposed to give""",
நன்றியில்செல்வம்,Wealth through Gratitude,அற்றார்க்கொன்று ஆற்றாதான் செல்வம் மிகநலம் பெற்றாள் தமியள்மூத் தற்று,""A maiden of bounteous merit, being single, if greyed: Such is wealth that is not used to aid the deprived""",
நன்றியில்செல்வம்,Wealth through Gratitude,நச்சப் படாதவன் செல்வம் நடுவூருள் நச்சு மரம்பழுத் தற்று,""Wealth of a person, who is loved by none, Is a toxic fruit tree in the middle of a town""",
நன்றியில்செல்வம்,Wealth through Gratitude,அன்பொரீஇத் தற்செற்று அறநோக்காது ஈட்டிய ஒண்பொருள் கொள்வார் பிறர்,""Devoid of love and denying oneself, Wealth gained with no scruples, others shall seize""",
நன்றியில்செல்வம்,Wealth through Gratitude,சீருடைச் செல்வர் சிறுதுனி மாரி வறங்கூர்ந் தனையது உடைத்து,When the famed wealthy go through poverty They resemble clouds that lost their bounty",
நாணுடைமை,Modesty,கருமத்தால் நாணுதல் நாணுந் திருநுதல் நல்லவர் நாணுப் பிற,Compunction is having scruples about one’s action Distinct from demureness of pretty-browed fine women",
நாணுடைமை,Modesty,ஊணுடை எச்சம் உயிர்க்கெல்லாம் வேறல்ல நாணுடைமை மாந்தர் சிறப்பு,Need for food and feeling of fear are common for all beings Compunction is the distinctive feature of mankind",
நாணுடைமை,Modesty,ஊனைக் குறித்த உயிரெல்லாம் நாண்என்னும் நன்மை குறித்தது சால்பு,""Food is the basis for all lives, the goodness Of compunction is the basis for nobleness""",
நாணுடைமை,Modesty,அணிஅன்றோ நாணுடைமை சான்றோர்க்கு அஃதின்றேல் பிணிஅன்றோ பீடு நடை,""For the noble, having compunction is an adornment; Without it, ain’t their proud stride an ailment""",
நாணுடைமை,Modesty,பிறர்பழியும் தம்பழியும் நாணுவார் நாணுக்கு உறைபதி என்னும் உலகு,""If blame for others and self, moves one to the same sense of shame The world shall call them the home for compunction""",
நாணுடைமை,Modesty,நாண்வேலி கொள்ளாது மன்னோ வியன்ஞாலம் பேணலர் மேலா யவர்,Great men desire not the vast world under their reign Without the protective fence of compunction",
நாணுடைமை,Modesty,நாணால் உயிரைத் துறப்பர் உயிர்ப்பொருட்டால் நாண்துறவார் நாணாள் பவர்,Their lives they may shed but never their scruples to save their lives They who by their scruples ever abide",
நாணுடைமை,Modesty,பிறர்நாணத் தக்கது தான்நாணா னாயின் அறம்நாணத் தக்கது உடைத்து,If what shames others doesn’t raise in him a qualm Virtue’ll flee him feeling that shame",
நாணுடைமை,Modesty,குலஞ்சுடும் கொள்கை பிழைப்பின் நலஞ்சுடும் நாணின்மை நின்றக் கடை,The family is hurt if one breaches convention All good is spoilt if there is lack of compunction",
நாணுடைமை,Modesty,நாண்அகத் தில்லார் இயக்கம் மரப்பாவை நாணால் உயிர்மருட்டி அற்று,""The actions of those who, deep within, have no compunction Is akin to a stringed puppet seeming alive, an illusion""",
குடிசெயல்வகை,Way of Living,கருமம் செயஒருவன் கைதூவேன் என்னும் பெருமையின் பீடுடையது இல்,""To proclaim, “I shall never take my hands off” to do one’s duty No acclaim can match that dignity""",
குடிசெயல்வகை,Way of Living,ஆள்வினையும் ஆன்ற அறிவும் எனஇரண்டின் நீள்வினையால் நீளும் குடி,Tasks one takes on with persistence and profound wisdom – The people shall prosper through them",
குடிசெயல்வகை,Way of Living,குடிசெய்வல் என்னும் ஒருவற்குத் தெய்வம் மடிதற்றுத் தான்முந் துறும்,""“I’ll serve my people,” for the one who so said God shall gird up his robes and rush to his aid""",
குடிசெயல்வகை,Way of Living,சூழாமல் தானே முடிவெய்தும் தம்குடியைத் தாழாது உஞற்று பவர்க்கு,""When for his kindred, one perseveres without respite: With no contriving, on its own, it’ll turn out right""",
குடிசெயல்வகை,Way of Living,குற்றம் இலனாய்க் குடிசெய்து வாழ்வானைச் சுற்றமாச் சுற்றும் உலகு,""Doing no wrong, the one who serves his kin – The world shall embrace as its own""",
குடிசெயல்வகை,Way of Living,நல்லாண்மை என்பது ஒருவற்குத் தான்பிறந்த இல்லாண்மை ஆக்கிக் கொளல்,One will be known for his imposing command when He takes command of the house where he was born",
குடிசெயல்வகை,Way of Living,அமரகத்து வன்கண்ணர் போலத் தமரகத்தும் ஆற்றுவார் மேற்றே பொறை,Like the bravehearts do on a battlefield The ablest takes charge of the household",
குடிசெயல்வகை,Way of Living,குடிசெய்வார்க் கில்லை பருவம் மடிசெய்து மானங் கருதக் கெடும்,To serve one’s people look not for the ripe hour Being lethargic and ego-centric makes all suffer",
குடிசெயல்வகை,Way of Living,இடும்பைக்கே கொள்கலம் கொல்லோ குடும்பத்தைக் குற்ற மறைப்பான் உடம்பு,Is his body the bin for all stress Who shields his kin from distress",
குடிசெயல்வகை,Way of Living,இடுக்கண்கால் கொன்றிட வீழும் அடுத்தூன்றும் நல்லாள் இலாத குடி,The people who have not a good man to lean on Shall fall with their base shorn by some affliction",
உழவு,Agriculture,சுழன்றும்ஏர்ப் பின்னது உலகம் அதனால் உழந்தும் உழவே தலை,""The world tails the plough despite other pursuit Even if one toils, farming remains foremost""",
உழவு,Agriculture,உழுவார் உலகத்தார்க்கு ஆணிஅஃ தாற்றாது எழுவாரை எல்லாம் பொறுத்து,""Farmers are the linchpin of the world All others not farming, it does hold""",
உழவு,Agriculture,உழுதுண்டு வாழ்வாரே வாழ்வார்மற் றெல்லாம் தொழுதுண்டு பின்செல் பவர்,""Only they live, who eat from what they plough Others follow, and to eat, they kowtow""",
உழவு,Agriculture,பலகுடை நீழலும் தங்குடைக்கீழ்க் காண்பர் அலகுடை நீழ லவர்,Who bring their land under their crops’ shade Many states under their king’s reign shall bade",
உழவு,Agriculture,இரவார் இரப்பார்க்கொன்று ஈவர் கரவாது கைசெய்தூண் மாலை யவர்,""They never beg, nor deny others, givin’ what they seek Whose nature is to eat what they till and make""",
உழவு,Agriculture,உழவினார் கைம்மடங்கின் இல்லை விழைவதூஉம் விட்டேம்என் பார்க்கும் நிலை,""If tillers fold their hands still, sages who say “I’ve given up desire,” as such cannot stay""",
உழவு,Agriculture,தொடிப்புழுதி கஃசா உணக்கின் பிடித்தெருவும் வேண்டாது சாலப் படும்,""If one measure of soil, is turned fine and dried to a quarter, Good yield needs not a handful of manure""",
உழவு,Agriculture,ஏரினும் நன்றால் எருவிடுதல் கட்டபின் நீரினும் நன்றதன் காப்பு,""Worthier than ploughing is to manure the field; Weeding done, worthier than watering is to secure the yield""",
உழவு,Agriculture,செல்லான் கிழவன் இருப்பின் நிலம்புலந்து இல்லாளின் ஊடி விடும்,""If from the land, her master stays off Like a wife, she’ll sulk and start a tiff""",
உழவு,Agriculture,இலமென்று அசைஇ இருப்பாரைக் காணின் நிலமென்னும் நல்லாள் நகும்,Mother Earth laughs at the sight of those who remain idle pleading poverty",
நல்குரவு,Healthy Livestock,இன்மையின் இன்னாதது யாதெனின் இன்மையின் இன்மையே இன்னா தது,""If you ask, what torments more than poverty: Only poverty can torment more than poverty""",
நல்குரவு,Healthy Livestock,இன்மை எனவொரு பாவி மறுமையும் இம்மையும் இன்றி வரும்,Poverty is a wretch; This life and the next does it snatch",
நல்குரவு,Healthy Livestock,தொல்வரவும் தோலும் கெடுக்கும் தொகையாக நல்குரவு என்னும் நசை,Ancestral legacy and parlance crumble in totality Due to hankering caused by poverty",
நல்குரவு,Healthy Livestock,இற்பிறந்தார் கண்ணேயும் இன்மை இளிவந்த சொற்பிறக்கும் சோர்வு தரும்,""From the high-born too, vile words may be born When deprivation makes them so cast down""",
நல்குரவு,Healthy Livestock,நல்குரவு என்னும் இடும்பையுள் பல்குரைத் துன்பங்கள் சென்று படும்,From the one misery named penury Emanates many a worry",
நல்குரவு,Healthy Livestock,நற்பொருள் நன்குணர்ந்து சொல்லினும் நல்கூர்ந்தார் சொற்பொருள் சோர்வு படும்,After deep reflection they may say words of deep essence Yet what the poor say may be seen to have no sense",
நல்குரவு,Healthy Livestock,அறஞ்சாரா நல்குரவு ஈன்றதா யானும் பிறன்போல நோக்கப் படும்,""Poverty aligned to no virtue makes even one’s mother Who bore him, to see him as a misfit""",
நல்குரவு,Healthy Livestock,இன்றும் வருவது கொல்லோ நெருநலும் கொன்றது போலும் நிரப்பு,Did not my poverty kill me yesterday? Does it have to be back again today",
நல்குரவு,Healthy Livestock,நெருப்பினுள் துஞ்சலும் ஆகும் நிரப்பினுள் யாதொன்றும் கண்பாடு அரிது,One may snatch a nap amidst raging fire But can not sleep a wink in poverty dire",
நல்குரவு,Healthy Livestock,துப்புர வில்லார் துவரத் துறவாமை உப்பிற்கும் காடிக்கும் கூற்று,When want does not make one give up desire It spells doom for salt and sour gruel next door",
இரவு,Night,இரக்க இரத்தக்கார்க் காணின் கரப்பின் அவர்பழி தம்பழி அன்று,""Seeks alms if you find those worthy of benefaction; If they refuse, blame is theirs and not yours""",
இரவு,Night,இன்பம் ஒருவற்கு இரத்தல் இரந்தவை துன்பம் உறாஅ வரின்,Seeking alms causes us great delight If what is sought is got without any plight",
