"Tamil_Category,English_Category,Tamil_Kural,English_Meaning",
சொல்வன்மை,Eloquence,வேட்பத்தாஞ் சொல்லிப் பிறர்சொல் பயன்கோடல் மாட்சியின் மாசற்றார் கோள்,""Speaking alluring words, and seeking to learn when others speak, is the way of those with impeccable qualities""",
சொல்வன்மை,Eloquence,சொலல்வல்லன் சோர்விலன் அஞ்சான் அவனை இகல்வெல்லல் யார்க்கும் அரிது,""If he speaks capably, flawlessly, and fearlessly, it is impossible to confront and defeat him""",
சொல்வன்மை,Eloquence,விரைந்து தொழில்கேட்கும் ஞாலம் நிரந்தினிது சொல்லுதல் வல்லார்ப் பெறின்,The world will instantly pay heed to those who can speak coherently and pleasingly",
சொல்வன்மை,Eloquence,பலசொல்லக் காமுறுவர் மன்றமா சற்ற சிலசொல்லல் தேற்றா தவர்,""Those who know not how to converse clearly and flawlessly in a few words, love to speak profusely""",
சொல்வன்மை,Eloquence,இண்ருழ்த்தும் நாறா மலரனையர் கற்றது உணர விரித்துரையா தார்,""Those who cannot convey, and make others comprehend, what they have learnt, are like a bunch of bloomed flowers that have no fragrance""",
வினைத்தூய்மை,Purity in Action,துணைநலம் ஆக்கம் த்ருஉம் வினைநலம் வேண்டிய எல்லாந் தரும்,""Good companions lead to valuable gains, and good deeds lead to everything needed""",
வினைத்தூய்மை,Purity in Action,என்றும் ஒருவுதல் வேண்டும் புகழொடு நன்றி பயவா வினை,They should be desisted from forever: deeds not leading to the good and yielding fame",
வினைத்தூய்மை,Purity in Action,ஒஓதல் வேண்டும் ஒளிமாழ்கும் செய்வினை ஆஅதும் என்னு மவர்,They who seek greater heights should shun deeds that dent their reputation",
வினைத்தூய்மை,Purity in Action,இடுக்கண் படினும் இளிவந்த செய்யார் நடுக்கற்ற காட்சி யவர்,""Even in distress, they won’t do deplorable deeds, those with unfaltering clarity and vision""",
வினைத்தூய்மை,Purity in Action,எற்றென்று இரங்குவ செய்யற்க செய்வானேல் மற்றன்ன செய்யாமை நன்று,""‘What have I done?’ – do not do deeds leading to such regret; even if you do, do not ever repeat them""",
வினைத்தூய்மை,Purity in Action,ஈன்றாள் பசிகாண்பான் ஆயினுஞ் செய்யற் க சான்றோர் பழிக்கும் வினை,""Even when you see your mother starving, don’t do deeds deplored by those, noble and respected""",
வினைத்தூய்மை,Purity in Action,பழிமலைந்து எய்திய ஆக்கத்தின் சான்றோர் கழிநல் குரவே தலை,Far better than ill-gotten wealth is the extreme poverty fallen on the noble and exemplary",
வினைத்தூய்மை,Purity in Action,கடிந்த கடிந்தொரார் செய்தார்க்கு அவைதாம் முடிந்தாலும் பீழை தரும்,""Though successful, they yield nothing but pain, when deplorable deeds are done rather than being shunned""",
வினைத்தூய்மை,Purity in Action,அழக் கொண்ட எல்லாம் அழப்போம் இழப்பினும் பிற்பயக்கும் நற்பா லவை,""What is acquired with others’ tears, goes away with your tears; good deeds, even if begun with losses, will yield fruits lat","er on"""
வினைத்தூய்மை,Purity in Action,சலத்தால் பொருள்செய்தே மார்த்தல் பசுமண் கலத்துள்நீர் பெய்திரீஇ யற்று,""Being content with ill-gotten wealth, is like storing water in a fresh unbaked mud pot""",
வினைத்திட்பம்,Perseverance in Action,வினைத்திட்பம் என்பது ஒருவன் மனத்திட்பம் மற்றைய எல்லாம் பிற,Execution focus lies in the resolve of the mind; all else is secondary",
வினைத்திட்பம்,Perseverance in Action,ஊறொரால் உற்றபின் ஒல்காமை இவ்விரண்டின் ஆறென்பர் ஆய்ந்தவர் கோள்,""Doing flawlessly, and resolute in the event of a flaw, are the paths shown by the learned""",
வினைத்திட்பம்,Perseverance in Action,கடைக்கொட்கச் செய்தக்க தாண்மை இடைக்கொட்கின் எற்றா விழுமந் தரும்,Virility lies in taking a task to completion; giving up midway causes endless misery",
வினைத்திட்பம்,Perseverance in Action,சொல்லுதல் யார்க்கும் எளிய அரியவாம் சொல்லிய வண்ணம் செயல்,""Easy it is, to say; rare it is, the ability to do what one says""",
வினைத்திட்பம்,Perseverance in Action,வீறெய்தி மாண்டார் வினைத்திட்பம் வேந்தன்கண் ஊறெய்தி உள்ளப் படும்,""Those who have gained great acclaim for their execution resolve, bring good to their rulers, and are hence thought","of highly"""
வினைத்திட்பம்,Perseverance in Action,எண்ணிய எண்ணியாங்கு எய்து எண்ணியார் திண்ணியர் ஆகப் பெறின்,""What they seek, they will achieve as they seek, if those who seek are made of firm resolve""",
வினைத்திட்பம்,Perseverance in Action,உருவுகண்டு எள்ளாமை வேண்டும் உருள்பெருந்தேர்க்கு அச்சாணி அன்னார் உடைத்து,""Deride not a person seeing their appearance; there are those who are like a small lynchpin that make a larg","e chariot roll.	66"""
வினைத்திட்பம்,Perseverance in Action,கலங்காது கண்ட வினைக்கண் துளங்காது தூக்கங் கடிந்து செயல்,""Do the task that you conceived with clarity of thought, unwaveringly and without procrastination""",
வினைத்திட்பம்,Perseverance in Action,துன்பம் உறவரினும் செய்க துணிவாற்றி இன்பம் பயக்கும் வினை,""Even if it causes distress while doing, daringly do the task that brings joy""",
வினைத்திட்பம்,Perseverance in Action,எனைத்திட்பம் எய் தியக் கண்ணும் வினைத்திட்பம் வேண்டாரை வேண்டாது உலகு,""Whatever ability they may have acquired, the world desires them not, when they desire not the resoluteness to e","xecute"""
வினைசெயல்வகை,Way of Performing Actions,சூழ்ச்சி முடிவு துணிவெய்தல் அத்துணிவு தாழ்ச்சியுள் தங்குதல் தீது,The end of strategizing is gaining the confidence to execute; it is wasteful to cede that confidence in delays",
வினைசெயல்வகை,Way of Performing Actions,தூங்குக தூங்கிச் செயற்பால தூங்கற்க தூங்காது செய்யும் வினை,""Delay those tasks that better be delayed; delay not, those tasks that cannot be delayed""",
வினைசெயல்வகை,Way of Performing Actions,ஙல்லும்வா யெல்லாம் வினைநன்றே ஒல்லாக்கால் செல்லும்வாய் நோக்கிச் செயல்,""Execute as planned whenever possible; when not possible, do whatever is needed to resume action""",
வினைசெயல்வகை,Way of Performing Actions,வினைபகை என்றிரண்டின் எச்சம் நினையுங்கால் தீயெச்சம் போலத் தெறும்,""The remnants of a task and an enmity, (left unfinished,) when we think of it, can harm as much as the remains of","a fire"""
வினைசெயல்வகை,Way of Performing Actions,பொருள்கருவி காலம் வினையிடனொடு ஐந்தும் இருள்தீர எண்ணிச் செயல்,""Resources, tools, time, place and the task – analyze these beyond doubt, and then act""",
வினைசெயல்வகை,Way of Performing Actions,முடிவும் இடையூறும் முற்றியாங்கு எய்தும் படுபயனும் பார்த்துச் செயல்,""The means to the end, the obstacles and the fruits of the deed – anticipate all these, and then act""",
வினைசெயல்வகை,Way of Performing Actions,செய்வினை செய்வான் செயன்முறை அவ்வினை உள்ளறிவான் உள்ளம் கொளல்,""One who is excellent at execution, executes after grasping the subtleties of all tasks from the experts""",
வினைசெயல்வகை,Way of Performing Actions,வினையான் வினையாக்கிக் கோடல் நனைகவுள் யானையால் யானையாத் தற்று,""Using one task to accomplish another task, is like tethering a musth elephant using another""",
வினைசெயல்வகை,Way of Performing Actions,நட்டார்க்கு நல்ல செயலின் விரைந்ததே ஒட்டாரை ஒட்டிக் கொளல்,""More pressing than doing favors to friends, is befriending foes""",
வினைசெயல்வகை,Way of Performing Actions,உறைசிறியார் உள்நடுங்கல் அஞ்சிக் குறைபெறின் கொள்வர் பெரியார்ப் பணிந்து,""The smaller state, fearing internal panic, will submit to a superior power, if their concerns are addressed",""""
தூது,Messenger,அன்புடைமை ஆன்ற குடிப்பிறத்தல் வேந்தவாம் பண்புடைமை தூதுரைப்பான் பண்பு,""Love, birth in a suitable family, affable nature attractive to any king are qualities of an emissary""",
தூது,Messenger,அன்பறிவு ஆராய்ந்த சொல்வன்மை தூதுரைப்பார்க்கு இன்றி யமையாத மூன்று,""Love, wisdom and sagacious speech are three qualities essential for an envoy""",
தூது,Messenger,நூலாருள் நூல்வல்லன் ஆகுதல் வேலாருள் வென்றி வினையுரைப்பான் பண்பு,""An emissary on a mission, seeking a diplomatic win over other rulers, should be learned enough to excel amongst the learned""",
தூது,Messenger,அறிவுரு வாராய்ந்த கல்விஇம் மூன்றன் செறிவுடையான் செல்க வினைக்கு,""Wisdom, physical presence and thorough learning – he who has these three in abundance, let him be the one to go on a diplomatic mission""",
தூது,Messenger,தொகச் சொல்லித் தூவாத நீக்கி நகச்சொல்லி நன்றி பயப்பதாந் தூது,""Being coherent, avoiding objectionable words, and evoking smiles are the ways of an envoy to get desired results""",
தூது,Messenger,கற்றுக்கண் அஞ்சான் செலச்சொல்லிக் காலத்தால் தக்கது அறிவதாம் தூது,""A good envoy is well learned, can look anyone in the eye, has compelling speech and comes up with timely strategies""",
தூது,Messenger,கடனறிந்து காலங் கருதி இடனறிந்து எண்ணி உரைப்பான் தலை,""Foremost among envoys is one who knows the task, weighs the time and place, and speaks with sagacity""",
தூது,Messenger,தூய்மை துணைமை துணிவுடைமை இம்மூன்றின் வாய்மை வழியுரைப்பான் பண்பு,""Principled, endearing and courageous – these three are qualities of an envoy conveying a message truthfully""",
தூது,Messenger,விடுமாற்றம் வேந்தர்க்கு உரைப்பான் வடுமாற்றம் வாய்சேரா வன்க ணவன்,""An emissary conveying his ruler’s message to another, should be firm enough never to denigrate him even by slip of tongue""",
தூது,Messenger,இறுதி பயப்பினும் எஞ்சாது இறைவற் கு உறுதி பயப்பதாம் தூது,""Even if it means meeting his own end, an emissary ought to further his leader’s ends""",
மன்னரைச் சேர்ந்தொழுதல்,Serving the King,அகலாது அணுகாது தீக்காய்வார் போல்க இகல்வேந்தர்ச் சேர்ந்தொழுகு வார்,""Not too far, not too near – while being with an irritable ruler, resemble those warming before a fire""",
மன்னரைச் சேர்ந்தொழுதல்,Serving the King,மன்னர் விழைப விழையாமை மன்னரால் மன்னிய ஆக்கந் தரும்,""Desiring not the objects of desire for the king, gives lasting riches through the king""",
மன்னரைச் சேர்ந்தொழுதல்,Serving the King,போற்றின் அரியவை போற்றல் கடுத்தபின் தேற்றுதல் யார்க்கும் அரிது,""If you deem it imperative, maintain impeccable decorum; it maybe tough to placate anyone, once they turn bitter""",
மன்னரைச் சேர்ந்தொழுதல்,Serving the King,செவிச்சொல்லும் சேர்ந்த நகையும் அவித்தொழுகல் ஆன்ற பெரியா ரகத்து,Whisper not in others’ ears nor giggle with them in the presence of dignified elders",
மன்னரைச் சேர்ந்தொழுதல்,Serving the King,எப்பொருளும் ஓரார் தொடரார்மற் றப்பொருளை விட்டக்கால் கேட்க மறை,Don’t eavesdrop on or badger about any confidential matter; hear it only when it is revealed",
மன்னரைச் சேர்ந்தொழுதல்,Serving the King,குறிப்பறிந்து காலங் கருதி வெறுப்பில வேண்டுப வேட்பச் சொலல்,""Gauge the mood; await the ripe time; avoid what he abhors; and speak what is essential, such that it charms him""",
மன்னரைச் சேர்ந்தொழுதல்,Serving the King,வேட்பன சொல்லி வினையில எஞ்ஞான்றும் கேட்பினும் சொல்லா விடல்,""Tell him what will enthrall him; but indulge not in useless small talk, even if he desires so""",
மன்னரைச் சேர்ந்தொழுதல்,Serving the King,இளையர் இனமுறையர் என்றிகழார் நின்ற ஒளியோடு ஒழுகப் படும்,Scorn him not because he is younger or is related; respect him for his position and reputation",
மன்னரைச் சேர்ந்தொழுதல்,Serving the King,கொளப்பட்டேம் என்றெண்ணிக் கொள்ளாத செய்யார் துளக்கற்ற காட்சி யவர்,Those with a clarity of purpose will refrain from acting repulsively thinking they command respect",
மன்னரைச் சேர்ந்தொழுதல்,Serving the King,பழையம் எனக்கருதிப் பண்பல்ல செய்யும் கெழுதகைமை கேடு தரும்,Taking advantage of proximity to the top and acting out of character brings ruin",
குறிப்பறிதல்,Understanding the Message,கூறாமை நோக்கிக் குறிப்பறிவான் எஞ்ஞான்றும் மாறாநீர் வையக் கணி,""He who reads minds by observing, with no words spoken, is ever an adornment for the world with unchanging oceans""",
குறிப்பறிதல்,Understanding the Message,ஐயப் படாஅது அகத்தது உணர்வானைத் தெய்வத்தோ டொப்பக் கொளல்,""Rate him amongst gods, he who can read minds with indubitable certainty""",
குறிப்பறிதல்,Understanding the Message,குறிப்பிற் குறிப்புணர் வாரை உறுப்பினுள் யாது கொடுத்தும் கொளல்,""Those who can read minds based on gestures or expressions – if need be, give any of your organs to have them with y","ou"""
குறிப்பறிதல்,Understanding the Message,குறித்தது கூறாமைக் கொள்வாரோ டேனை உறுப்போ ரனையரால் வேறு,""Who can sense thoughts without being told, they are distinct, resembling others only in their human forms""",
குறிப்பறிதல்,Understanding the Message,குறிப்பிற் குறிப்புணரா வாயின் உறுப்பினுள் என்ன பயத்தவோ கண்,""If one can’t observe and interpret body language, what purpose do eyes serve amongst the organs""",
குறிப்பறிதல்,Understanding the Message,அடுத்தது காட்டும் பளிங்குபோல் நெஞ்சம் கடுத்தது காட்டும் முகம்,""The face, like a crystal that shows the hues of objects around, betrays the mood of the mind""",
குறிப்பறிதல்,Understanding the Message,முகத்தின் முதுக்குறைந்தது உண்டோ உவப்பினும் காயினும் தான்முந் துறும்,What can be smarter than the face? It is quick to sense and show if the heart is pleased or peeved",
குறிப்பறிதல்,Understanding the Message,முகம்நோக்கி நிற்க அமையும் அகம்நோக்கி உற்ற துணர்வார்ப் பெறின்,""When those who can look into your heart and know your intentions, be with you, tasks will be accomplished if you jus","t face them"""
குறிப்பறிதல்,Understanding the Message,பகைமையும் கேண்மையும் கண்ணுரைக்கும் கண்ணின் வகைமை உணர்வார்ப் பெறின்,The eyes will convey the animosity or affinity to those who can decipher the subtleties of the eyes",
குறிப்பறிதல்,Understanding the Message,நுண்ணியம் என்பார் அளக்குங்கோல் காணுங்கால் கண்ணல்லது இல்லை பிற,""The scale used by the astute to gauge the emotions, if you think of it, is nothing but the eyes""",
அவையறிதல்,Understanding the World,அவையறிநது ஆராய்ந்து சொல்லுக சொல்லின் தொகையறிந்த தூய்மை யவர்,""Those who are well versed with the various ways of speech, know and assess the audience before speaking""",
அவையறிதல்,Understanding the World,இடைதெரிந்து நன்குணர்ந்து சொல்லுக சொல்லின் நடைதெரிந்த நன்மை யவர்,""Before speaking,anticipate the reaction of the audience and master the subject, if you are conversant with the modes o","f expression"""
அவையறிதல்,Understanding the World,அவையறியார் சொல்லல்மேற் கொள்பவர் சொல்லின் வகையறியார் வல்லதூஉம் இல்,""Those who know not their audience and yet endeavor to speak, know not the styles of speech and their reach, nor can","they be competent"""
அவையறிதல்,Understanding the World,ஒளியார்முன் ஒள்ளிய ராதல் வெளியார்முன் வான்சுதை வண்ணம் கொளல்,""Be brilliant before the bright, and amidst the ignorant turn blank as a wall plastered white""",
அவையறிதல்,Understanding the World,நன்றென்ற வற்றுள்ளும் நன்றே முதுவருள் முந்து கிளவாச் செறிவு,""It is the best among all the good deeds to have the restraint to not speak out of turn, in a forum of learned elders""",
அவையறிதல்,Understanding the World,ஆற்றின் நிலைதளர்ந் தற்றே வியன்புலம் ஏற்றுணர்வார் முன்னர் இழுக்கு,""It will tantamount to swerving from the righteous path, being disgraced before an audience, widely-read but highly-re","ceptive"""
அவையறிதல்,Understanding the World,கற்றறிந்தார் கல்வி விளங்கும் கசடறச் சொல்தெரிதல் வல்லார் அகத்து,The expertise of the erudite gets enhanced by addressing an audience capable of flawlessly grasping those words",
அவையறிதல்,Understanding the World,உணர்வ துடையார்முன் சொல்லல் வளர்வதன் பாத்தியுள் நீர்சொரிந் தற்று,""To speak before an audience who possess clear understanding is like watering a sapling, growing by itself in a nursery",""""
அவையறிதல்,Understanding the World,புல்லவையுள் பொச்சாந்தும் சொல்லற்க நல்லவையுள் நன்குசலச் சொல்லு வார்,Those who can speak lucidly in a learned forum should refrain from even forgetfully speaking the same in an unworthy",forum
அவையறிதல்,Understanding the World,அங்கணத்துள் உக்க அமிழ்தற்றால் தங்கணத்தார் அல்லார்முன் கோட்டி கொளல்,""Speaking before an audience who are no match for you, is like throwing away the elixir of life into the drains""",
அவையஞ்சாமை,Avoiding Harm to Others,வகையறிந்து வல்லவை வாய்சோரார் சொல்லின் தொகையறிந்த தூய்மை யவர்,""Those who are well versed with the various ways of speech, will choose the right style for a forum, and won’t blunder ou","t of fear"""
அவையஞ்சாமை,Avoiding Harm to Others,கற்றாருள் கற்றார் எனப்படுவர் கற்றார்முன் கற்ற செலச்சொல்லு வார்,""They are known the most learned amongst the learned, those who can express their learnings persuasively before a learn","ed audience"""
